segment_name,key_interests,preferred_language,content_examples_they_like
Small Business Owners,"Quick hires, local talent, cost-effective staffing",Clear and results-focused,"Email showcasing time-to-hire stats, blog post on reducing hiring costs, local success story"
Healthcare Facilities,"Certified professionals, shift flexibility, background checks",Formal and trust-building,"Landing page for certified nurse hiring, email about pre-screening processes"
Light Industrial Employers,"Reliable labor, work ethic, safety compliance",Straightforward and practical,"Blog post on vetting temps for warehouse jobs, social post showing safety training procedures"
Job Seekers - Entry Level,"Resume tips, job readiness, interview coaching",Supportive and motivational,"Instagram reel with job interview tips, email about free resume review"
Tech Startups,"Agile hiring, niche tech talent, culture fit",Trendy and energetic,"Blog on hiring devs for MVPs, social media carousel on remote-ready candidates"
Bilingual Employers,"Multilingual candidates, customer service, community reach",Inclusive and respectful,"Testimonial from bilingual hire, email about language fluency filters"
Job Seekers - Skilled Trades,"Certifications, steady work, pay transparency",No-nonsense and honest,"Email about electrician openings with pay range, flyer on trade job fairs"